{
  "task_hash": "sha256:98b64743fb92cf6f73d39d81935403e6addc685e24777be375e482e219ecc0df",
  "capability": "invoice-data-extraction",
  "taxonomy_node": "arc.document.extraction.invoice",
  "buyer_aid": "arc:mkt.example:BQ7TQ9P2XXTR84MN",
  "seller_aid": "arc:mkt.example:7K3MQ9P2XXTR84MN",
  "engagement_ref": "sha256:13151606c657c1e3a3aa487a5adedefeb1d416d6434aca07dbae7e34bd4f1a85",
  "snapshot_ref": "sha256:1661f52a0e5681208646f1ca43a974994c81a56371f8fb31085199efd67fb575",
  "timestamps": {
    "delegated": "2026-08-25T10:30:02Z",
    "delivered": "2026-08-25T10:30:03.4Z"
  },
  "units": {
    "unit": "page",
    "count": 12
  },
  "payment": {
    "amount": {
      "amount": "0.072",
      "currency": "USD"
    },
    "escrow_ref": "esc-1",
    "payout_tier": "slo_met"
  },
  "allocation": {
    "cost_center": "FIN-OPS-114",
    "project": "ap-automation",
    "workflow_id": "wf-88"
  },
  "seller_sig": "eyJhbGciOiJFZERTQSIsImI2NCI6ZmFsc2UsImNyaXQiOlsiYjY0Il19..EXAMPLE-SIGNATURE-NOT-VERIFIABLE",
  "buyer_countersig": "eyJhbGciOiJFZERTQSIsImI2NCI6ZmFsc2UsImNyaXQiOlsiYjY0Il19..EXAMPLE-SIGNATURE-NOT-VERIFIABLE"
}
